{
  "schema_version": "0.1",
  "generated_at": 2000000000,
  "status": "ok",
  "providers": {
    "codex": {
      "status": "ok",
      "source": "codex_app_server",
      "collected_at": 1999999980,
      "stale_after_seconds": 600,
      "meters": [
        {
          "id": "five_hour",
          "label": "5 hour",
          "kind": "quota",
          "unit": "percent",
          "remaining_percentage": 82,
          "reset_at": 2000003600
        },
        {
          "id": "weekly",
          "label": "Weekly",
          "kind": "quota",
          "unit": "percent",
          "remaining_percentage": 95,
          "reset_at": 2000600000
        }
      ]
    },
    "cursor": {
      "status": "ok",
      "source": "cursor_dashboard_connect_rpc",
      "collected_at": 1999999970,
      "stale_after_seconds": 900,
      "meters": [
        {
          "id": "cursor_models",
          "label": "Cursor Models",
          "kind": "quota",
          "unit": "percent",
          "remaining_percentage": 36.55,
          "reset_at": 2000600000
        },
        {
          "id": "other_models",
          "label": "Other Models",
          "kind": "quota",
          "unit": "percent",
          "remaining_percentage": 99.18,
          "reset_at": 2000600000
        }
      ]
    },
    "claude": {
      "status": "ok",
      "source": "claude_statusline",
      "collected_at": 1999999960,
      "stale_after_seconds": 900,
      "meters": [
        {
          "id": "five_hour",
          "label": "5 hour",
          "kind": "quota",
          "unit": "percent",
          "remaining_percentage": 76.5,
          "reset_at": 2000004000
        },
        {
          "id": "weekly",
          "label": "Weekly",
          "kind": "quota",
          "unit": "percent",
          "remaining_percentage": 58.8,
          "reset_at": 2000600400
        }
      ]
    }
  }
}
