{
  "schema_version": "0.1",
  "generated_at": 2000000000,
  "status": "ok",
  "providers": {
    "cursor": {
      "status": "ok",
      "source": "cursor_dashboard_connect_rpc",
      "collected_at": 1999999970,
      "stale_after_seconds": 900,
      "meters": [
        {
          "id": "cursor_models",
          "label": "Cursor Models",
          "kind": "quota",
          "unit": "percent",
          "remaining_percentage": 36.55,
          "reset_at": 2000600000
        },
        {
          "id": "other_models",
          "label": "Other Models",
          "kind": "quota",
          "unit": "percent",
          "remaining_percentage": 99.18,
          "reset_at": 2000600000
        },
        {
          "id": "on_demand",
          "label": "On-demand",
          "kind": "spend",
          "unit": "currency",
          "used": 4.5,
          "currency_code": "USD",
          "reset_at": 2000600000
        }
      ]
    }
  }
}
