{
  "schema_version": "0.1",
  "generated_at": 2000000000,
  "status": "partial",
  "providers": {
    "codex": {
      "status": "ok",
      "source": "codex_app_server",
      "collected_at": 1999999980,
      "stale_after_seconds": 600,
      "meters": [
        {
          "id": "weekly",
          "label": "Weekly",
          "kind": "quota",
          "unit": "percent",
          "remaining_percentage": 95,
          "reset_at": 2000600000
        }
      ]
    },
    "cursor": {
      "status": "stale",
      "source": "cursor_dashboard_connect_rpc",
      "collected_at": 1999998000,
      "stale_after_seconds": 900,
      "meters": [
        {
          "id": "cursor_models",
          "label": "Cursor Models",
          "kind": "quota",
          "unit": "percent",
          "remaining_percentage": 36.55,
          "reset_at": 2000600000
        }
      ],
      "error": {
        "category": "timeout",
        "message": "Cursor usage request timed out",
        "retryable": true
      }
    },
    "claude": {
      "status": "unavailable",
      "source": "claude_statusline",
      "collected_at": null,
      "stale_after_seconds": 900,
      "meters": [],
      "error": {
        "category": "not_authenticated",
        "message": "Claude Code session is unavailable",
        "retryable": false
      }
    }
  }
}
